{
  "packet_id": "rule_after_measurement",
  "evidence_mode": "synthetic_demo",
  "requested_claim": "research_diagnostic",
  "observations": [
    {
      "id": "O_F",
      "value": 0.95,
      "unit": "1",
      "quantity_kind": "regular_transmittance",
      "coordinate": "finite_sample_external",
      "t_s": 10.0,
      "run_id": "run_fit",
      "sample_id": "synthetic_fit_sample",
      "reading_origin": "measured",
      "raw_ref": "synthetic://F",
      "requires_lock": false,
      "lock_state": "not_applicable",
      "controller_mode": "measurement",
      "parameter_snapshot_id": "P1",
      "parameter_switched": false,
      "parameter_event_id": null,
      "negative_clip_mode": "none",
      "transformation_ref": null,
      "calibration_id": "C1"
    },
    {
      "id": "O_H",
      "value": 0.949,
      "unit": "1",
      "quantity_kind": "regular_transmittance",
      "coordinate": "finite_sample_external",
      "t_s": 10.0,
      "run_id": "run_heldout",
      "sample_id": "synthetic_heldout_sample",
      "reading_origin": "measured",
      "raw_ref": "synthetic://H",
      "requires_lock": false,
      "lock_state": "not_applicable",
      "controller_mode": "measurement",
      "parameter_snapshot_id": "P1",
      "parameter_switched": false,
      "parameter_event_id": null,
      "negative_clip_mode": "none",
      "transformation_ref": null,
      "calibration_id": "C1"
    }
  ],
  "datasets": [
    {
      "id": "D_F",
      "role": "fit",
      "observation_ids": [
        "O_F"
      ],
      "used_to_update_model": true
    },
    {
      "id": "D_H",
      "role": "heldout_final",
      "observation_ids": [
        "O_H"
      ],
      "used_to_update_model": false
    }
  ],
  "parameter_snapshots": [
    {
      "id": "P1",
      "material_id": "synthetic_film",
      "density_kg_m3": 5000.0,
      "z_factor": 1.0,
      "tooling_fraction": 1.0,
      "feedback_coordinate": "qcm_equivalent",
      "display_coordinate": "sample_estimate"
    }
  ],
  "events": [],
  "calibrations": [
    {
      "id": "C1",
      "within_scope": true,
      "basis_ref": "synthetic://calibration_domain"
    }
  ],
  "numerics": [
    {
      "id": "analytic",
      "status": "validated_analytic",
      "required_for_claim": true,
      "calls": 1,
      "budget": 1,
      "stop_reason": "exact_demo_formula"
    }
  ],
  "cross_split_correlation": {
    "status": "known_synthetic",
    "basis_ref": "synthetic://shared_reference_covariance"
  },
  "decision_rule": {
    "rule_id": "project_closed_interval_v1",
    "preagreed": false,
    "approval_ref": "synthetic://preregistered_rule"
  },
  "source_visibility": [
    {
      "source_id": "old_source",
      "workpiece_visibility": "unknown",
      "position_evidence_ref": null,
      "thermal_state": "unknown",
      "zero_flux_verified": false,
      "zero_flux_basis_ref": null
    }
  ]
}
